BROKERTITLE,TYPE,PRICE,BEDS,BATH,PROPERTYSQFT,STATE,MAIN_ADDRESS,ADMINISTRATIVE_AREA_LEVEL_2,LOCALITY,SUBLOCALITY,LATITUDE,LONGITUDE
Brokered by De Luca Realty Group INC,Co-op,299999,2,1,857.0,Bronx,"44B Edgewater Park Unit 44BBronx, NY 10465",New York,Bronx County,The Bronx,40.8227774,-73.8084775
Brokered by NEUHAUS REALTY INC.,House,2358000,4,5,6300.0,Staten Island,"797 Woodrow RdStaten Island, NY 10312",United States,New York,Richmond County,40.5467194,-74.1923203
"Brokered by Tom Crimmins Realty, Ltd.",House,748888,2,2,1260.0,Staten Island,"40 Lander AveStaten Island, NY 10314",United States,New York,Richmond County,40.6131085,-74.1603745
"Brokered by Robert DeFalco Realty, Inc.",House,630000,2,2,1450.0,Staten Island,"14 Buffalo StStaten Island, NY 10306",United States,New York,Richmond County,40.5604211,-74.1344639
Brokered by Mcgrath Realty Inc.,Condo,1389000,2,2,1043.0,New York,"40 Pinehurst Ave Apt 8BNew York, NY 10033",New York,New York County,New York,40.849705,-73.94014
Brokered by Keller Williams Points North,Co-op,319000,2,1,925.0,Forest Hills,"108-49 63rd Ave Unit 6FForest Hills, NY 11375",New York,Queens County,Queens,40.7355842,-73.8491198
Brokered by Sowae Corp,House,319000,3,1,2184.207862,Staten Island,"20 Eldridge AveStaten Island, NY 10302",United States,New York,Richmond County,40.6242127,-74.1357292
Brokered by COMPASS REALTY CENTRAL INC,Pending,1250000,6,4,2184.207862,Staten Island,"318 Brighton StStaten Island, NY 10307",United States,New York,Richmond County,40.5022937,-74.2429452
Brokered by COMPASS,Multi-family home,1199000,4,3,1848.0,Fresh Meadows,"73-38 199th StFresh Meadows, NY 11366",United States,New York,Queens County,40.7349473,-73.7733194
Brokered by UNITED NATIONAL REALTY,Multi-family home,1500000,6,4,3328.0,Staten Island,"51 Jefferson AveStaten Island, NY 10306",United States,New York,Richmond County,40.585111,-74.1036081
"Brokered by Brooklyn Real Property, Inc",House,780000,3,2,1320.0,Brooklyn,"1324 E 101st StBrooklyn, NY 11236",United States,New York,Kings County,40.6384339,-73.8899834
Brokered by Ubiq,Co-op,350000,2,1,2184.207862,New York,"655 Riverside Dr Apt 1ANew York, NY 10031",New York,New York County,New York,40.8255972,-73.9529963
Brokered by CENTURY 21 Homefront,Co-op,255000,1,1,750.0,Brooklyn,"464 Neptune Ave Apt 4EBrooklyn, NY 11224",New York,Kings County,Brooklyn,40.5792324,-73.9713245
Brokered by E House Realty & Mgt. Inc.,Condo,649000,2,2,905.0,Brooklyn,"217 Bay 49th St Unit 4ABrooklyn, NY 11214",United States,New York,Kings County,40.5855131,-73.9883977
Brokered by E Realty International Corp,House,1480000,4,4,1596.0,Flushing,"30-07 143rd StFlushing, NY 11354",United States,New York,Queens County,40.7699832,-73.8257555
"Brokered by Homes R Us Realty of NY, Inc.",House,628000,3,2,1824.0,Staten Island,"35 Lott LnStaten Island, NY 10314",United States,New York,Richmond County,40.5755968,-74.1636272
Brokered by CENTURY 21 Future Homes Realty,Co-op,190000,2,1,875.0,Bronx,"3065 Sedgwick Ave Apt 3EBronx, NY 10468",New York,Bronx County,The Bronx,40.8766081,-73.8998497
Brokered by Acadia Real Estate Grp LLC,Condo,450000,2,1,2184.207862,Flushing,"132-50 Maple Ave Unit B4RFlushing, NY 11355",New York,Queens County,Queens,40.7541793,-73.8310866
"Brokered by Robert DeFalco Realty, Inc.",Contingent,2473888,4,6,5600.0,Staten Island,"284 Vineland AveStaten Island, NY 10312",United States,New York,Richmond County,40.5464716,-74.1880551
Brokered by DiTommaso Real Estate,Contingent,785000,3,2,1950.0,Staten Island,"148 Major AveStaten Island, NY 10305",United States,New York,Richmond County,40.5990416,-74.0674289
Brokered by EXIT ALL SEASONS REALTY,House,699900,3,2,1240.0,Middle Village,"62-22 65th StMiddle Village, NY 11379",United States,New York,Queens County,40.71397,-73.8970573
Brokered by Corcoran Long Island City,Multi-family home,2495000,3,4,2184.207862,Queens,"69-04 Ditmars BlvdQueens, NY 11370",United States,New York,Queens County,40.7679759,-73.899664
Brokered by Houlihan Lawrence,Co-op,149999,1,1,850.0,Bronx,"4295 Webster Ave Apt 4BBronx, NY 10470",New York,Bronx County,The Bronx,40.8992144,-73.8624103
Brokered by New York Residential R E,Co-op,208000,1,1,610.0,Whitestone,"159-04 16th Ave Unit 6-68Whitestone, NY 11357",New York,New York County,New York,40.7398044,-73.9980373
Brokered by Pride Estates,Pending,172800,1,1,750.0,Brooklyn,"2010 E 58th St Unit 120BBrooklyn, NY 11234",New York,Kings County,Brooklyn,40.6149015,-73.9185548
Brokered by Lombardo Homes & Estates,Multi-family home,1768888,10,10,3933.0,Brooklyn,"5502 6th AveBrooklyn, NY 11220",United States,New York,Kings County,40.6410259,-74.0112793
Brokered by J Milo Real Estate,Multi-family home,1239998,4,4,2250.0,Staten Island,"664 Ramona AveStaten Island, NY 10309",United States,New York,Richmond County,40.5355587,-74.2075918
Brokered by Link Ny Realty,Multi-family home,1699000,9,5,5500.0,Bronx,"3179 Rochambeau AveBronx, NY 10467",United States,New York,Bronx County,40.8754624,-73.8807502
Brokered by Signature Premier Properties,House,1350000,3,3,2184.207862,Fresh Meadows,"76-73 173rd StFresh Meadows, NY 11366",United States,New York,Queens County,40.724706,-73.7957477
"Brokered by Robert Defalco Realty, Inc.",House,889000,3,2,2362.0,Staten Island,"107 S Railroad StStaten Island, NY 10312",United States,New York,Richmond County,40.5395766,-74.1810757
Brokered by Corcoran Brooklyn Heights,Condo,1300000,2,2,1100.0,Brooklyn,"529 Court St Apt 406Brooklyn, NY 11231",New York,Kings County,Brooklyn,40.6746458,-73.9992831
Brokered by Douglas Elliman - New Hyde Park,Co-op,310000,2,1,675.0,Bellerose,"247-16A 76 Ave Unit 1FLBellerose, NY 11426",New York,Queens County,Queens,40.7444053,-73.7237661
Brokered by RE MAX Edge,Pending,1149000,7,4,3617.0,Bronx,"1949 Benedict AveBronx, NY 10462",United States,New York,Bronx County,40.8343858,-73.8590313
Brokered by Miller & Miller Real Estate,Co-op,239900,1,1,585.0,Glen Oaks,"71-27 260th St Unit A2Glen Oaks, NY 11004",New York,Queens County,Queens,40.7516659,-73.7183001
Brokered by Tworealestate Llc,Co-op,257000,3,1,450.0,Brooklyn,"40 Brighton 1st Rd Apt 11DBrooklyn, NY 11235",New York,Kings County,Brooklyn,40.5756277,-73.9667833
Brokered by Midas Realty,Condo,1090000,2,2,1860.0,Bayside,"207-15 Melissa Ct Unit 219LBayside, NY 11360",New York,Queens County,Queens,40.7879226,-73.7863723
Brokered by Budget Real Estate Nyc Inc,Multi-family home,799999,6,2,2184.207862,Brooklyn,"1278 E 56th StBrooklyn, NY 11234",United States,New York,Kings County,40.6245872,-73.9219517
"Brokered by Harlem Lofts Inc.- Harlem Lofts, Inc.",Townhouse,2045000,6,4,3976.0,New York,"594 W 152nd StNew York, NY 10031",United States,New York,New York County,40.8305666,-73.9469641
"Brokered by Robert DeFalco Realty, Inc.",Multi-family home,1195000,3,2,2700.0,Staten Island,"72 Jeanette AveStaten Island, NY 10312",United States,New York,Richmond County,40.5424657,-74.1746625
Brokered by CENTURY 21 Galvez,Co-op,340000,2,1,900.0,Bronx,"6035 Broadway Apt 6NBronx, NY 10471",New York,Bronx County,The Bronx,40.8919476,-73.8973687
Brokered by RE MAX 1st Choice,House,1375000,6,2,1596.0,Flushing,"33-14 154th StFlushing, NY 11354",United States,New York,Queens County,40.7681033,-73.8107752
Brokered by Taranto Realty,House,749000,3,1,1644.0,Staten Island,"668 Bard AveStaten Island, NY 10310",United States,New York,Richmond County,40.6267035,-74.1052076
Brokered by Keller Williams Realty Liberty,Pending,1399000,5,4,2184.207862,Woodhaven,"84-26 87th StWoodhaven, NY 11421",United States,New York,Queens County,40.6960034,-73.8584205
Brokered by COMPASS,Co-op,775000,3,2,1880.0,Manhattan,"175 E 62nd St Apt 14AManhattan, NY 10065",New York,New York County,New York,40.7636632,-73.9655082
Brokered by Voro Llc,Multi-family home,948000,7,3,2184.207862,Saint Albans,"194-08 116th AveSaint Albans, NY 11412",United States,New York,Queens County,40.694328,-73.7581979
Brokered by EXP Realty,House,880000,3,2,2184.207862,Woodside,"41-39 56th StWoodside, NY 11377",United States,New York,Queens County,40.7439956,-73.908547
Brokered by Douglas Elliman - 1995 Broadway,Co-op,699000,1,1,600.0,New York,"170 W 74th St Apt 607New York, NY 10023",New York,New York County,New York,40.7794608,-73.979919
Brokered by COMPASS,Co-op,2250000,4,3,2184.207862,Manhattan,"225 Central Park W Unit 422423Manhattan, NY 10024",United States,New York,New York County,40.7830893,-73.9713177
Brokered by COMPASS,Co-op,319000,3,1,2184.207862,Manhattan,"36 W 138th St Apt 51Manhattan, NY 10037",New York,New York County,New York,40.8153009,-73.9380717
Brokered by True Homes Inc,Multi-family home,1300000,6,3,2184.207862,Brooklyn,"1309 E 56th StBrooklyn, NY 11234",United States,New York,Kings County,40.6236835,-73.9213087
Brokered by Fillmore Real Estate,Multi-family home,729000,3,3,1800.0,Brooklyn,"8424 Glenwood RdBrooklyn, NY 11236",United States,New York,Kings County,40.6391205,-73.9112362
Brokered by Real Broker Llc,Condo,425000,2,2,800.0,Bronx,"3240 Netherland Ave Apt 6ABronx, NY 10463",New York,Bronx County,The Bronx,40.8848915,-73.9110436
Brokered by Corcoran West Side Gallery,Co-op,399000,1,1,2184.207862,New York,"521 E 81st St Apt 4CNew York, NY 10028",New York,New York County,New York,40.7723985,-73.9482206
Brokered by Corcoran Brooklyn Heights,Co-op,625000,3,1,652.0,Brooklyn,"28 Old Fulton St Apt 6MBrooklyn, NY 11201",Kings County,Brooklyn,Brooklyn Heights,40.702334,-73.9937463
Brokered by Mjr Real Estate Llc,Co-op,269000,1,1,700.0,Rego Park,"97-37 63 Rd Unit 5FRego Park, NY 11374",New York,Queens County,Queens,40.7318958,-73.8599645
Brokered by UNITED NATIONAL REALTY,Condo,449000,2,2,1440.0,Staten Island,"1722 Forest Hill RdStaten Island, NY 10314",United States,New York,Richmond County,40.580134,-74.154154
Brokered by Keystone Realty USA Corp,Multi-family home,699000,8,5,2300.0,Bronx,"1998 Clinton AveBronx, NY 10457",United States,New York,Bronx County,40.8460907,-73.8887912
Brokered by COMPASS,Co-op,550000,3,2,1250.0,Manhattan,"2041 5th Ave Apt 2BManhattan, NY 10035",New York,New York County,New York,40.8071957,-73.941821
"Brokered by Homes R Us Realty of NY, Inc.",Townhouse,799900,3,2,2058.0,Staten Island,"25 Flagship CirStaten Island, NY 10309",United States,New York,Richmond County,40.5147701,-74.2022363
Brokered by RE MAX Edge,House,758000,3,1,1200.0,Brooklyn,"86 Bay 46th StBrooklyn, NY 11214",11214,United States,New York,40.5908794,-73.9865956
"Brokered by Century 21 Amiable Realty Group II, Inc.",House,829000,4,2,1680.0,Howard Beach,"159-31 80th StHoward Beach, NY 11414",United States,New York,Queens County,40.6565796,-73.8516349
Brokered by Ilite Realty Inc,Condo,789000,2,2,1230.0,Brooklyn,"40 Oceana Dr W Unit 1CBrooklyn, NY 11235",New York,Kings County,Brooklyn,40.577533,-73.958513
Brokered by Corcoran Brooklyn Heights,House,2250000,6,4,2184.207862,Brooklyn,"144 Nassau AveBrooklyn, NY 11222",United States,New York,Kings County,40.7246592,-73.9475691
Brokered by COMPASS,Co-op,359000,1,1,2184.207862,Manhattan,"229 E 81st St Unit GhManhattan, NY 10028",United States,New York,New York County,40.7751786,-73.9550168
Brokered by RE MAX Real Estate Professionals,House,1439000,6,4,1440.0,Brooklyn,"1019 58th StBrooklyn, NY 11219",United States,New York,Kings County,40.6337561,-74.003307
Brokered by Exit Realty DKC,Multi-family home,1050000,7,4,3280.0,Bronx,"1135 Croes AveBronx, NY 10472",United States,New York,Bronx County,40.8282228,-73.8706372
Brokered by Exp Realty,Co-op,134500,3,1,503.0,Bronx,"601 Kappock St Apt 1GBronx, NY 10463",New York,Bronx County,The Bronx,40.8789773,-73.916004
Brokered by Sowae Corp,House,270000,4,2,2000.0,Bronx,"2417 Cambreleng AveBronx, NY 10458",United States,New York,Bronx County,40.8550515,-73.8852304
Brokered by Key Impact Realty Group Inc,Multi-family home,2280000,6,5,2184.207862,Flushing,"137-06 Oak AveFlushing, NY 11355",United States,New York,Queens County,40.7472951,-73.8164494
Brokered by Voro Llc,Co-op,278999,1,1,2184.207862,Little Neck,"5811 251st St Unit UpperLittle Neck, NY 11362",United States,New York,Queens County,40.7601741,-73.728329
Brokered by Sowae Corp,Multi-family home,625000,5,2,2184.207862,Brooklyn,"371 Kosciuszko StBrooklyn, NY 11221",United States,New York,Kings County,40.6921071,-73.9400823
Brokered by Island Advantage Realty LLC,Foreclosure,605000,4,2,1344.0,Staten Island,"253 Father Capodanno BlvdStaten Island, NY 10305",United States,New York,Richmond County,40.5909939,-74.0662942
Brokered by American Homes Group,House,529000,3,2,1150.0,Staten Island,"1524 Castleton AveStaten Island, NY 10302",United States,New York,Richmond County,40.635324,-74.133679
Brokered by Corcoran Park Slope,Townhouse,1050000,4,1,2184.207862,Brooklyn,"1023 Union StBrooklyn, NY 11225",United States,New York,Kings County,40.6701878,-73.9595284
Brokered by COMPASS,Co-op,225000,3,1,2184.207862,Manhattan,"11 St Nicholas Ave Unit 4DManhattan, NY 10026",New York,New York County,New York,40.7992319,-73.9526079
Brokered by Stonegate Real Estate,Townhouse,1049000,3,1,1224.0,Forest Hills,"67101 Dartmouth StForest Hills, NY 11375",United States,New York,Queens County,40.7207542,-73.8537801
Brokered by Century Homes Realty Group LLC,Co-op,259000,1,1,2184.207862,Jackson Heights,"37-30 73 St Unit 1HJackson Heights, NY 11372",New York,Queens County,Queens,40.7488599,-73.8926999
Brokered by Coldwell Banker Kueber Realty,House,599000,3,2,2184.207862,Brooklyn,"425 Snediker AveBrooklyn, NY 11207",United States,New York,Kings County,40.6645719,-73.8995034
Brokered by Wonica REALTORS & Appraisers,Contingent,675000,3,1,1316.0,Staten Island,"192 Hart BlvdStaten Island, NY 10301",United States,New York,Richmond County,40.630475,-74.100665
Brokered by Coldwell Banker Warburg,Condo,3595000,3,3,1862.0,New York,"475 Greenwich St Apt 2ANew York, NY 10013",New York,New York County,New York,40.7241961,-74.0091487
Brokered by J Milo Real Estate,Contingent,789000,4,2,1871.0,Staten Island,"19 Goff AveStaten Island, NY 10309",United States,New York,Richmond County,40.5248784,-74.2121776
Brokered by Keller Williams Realty Liberty,Multi-family home,998000,6,3,1872.0,Ridgewood,"59-38 Linden StRidgewood, NY 11385",United States,New York,Queens County,40.7086372,-73.9026067
Brokered by TOP NEST INC,Multi-family home,889000,6,2,2280.0,Bronx,"1349 Herschell StBronx, NY 10461",United States,New York,Bronx County,40.8368581,-73.8449273
Brokered by Corcoran Park Slope,House,825000,2,2,1820.0,Brooklyn,"1666 73rd StBrooklyn, NY 11204",United States,New York,Kings County,40.6163169,-73.9981652
Brokered by JOSK REALTY LLC,Multi-family home,599999,6,2,3490.0,Brooklyn,"919 Crescent StBrooklyn, NY 11208",United States,New York,Kings County,40.6649303,-73.8670719
Brokered by Corcoran East Side,Townhouse,10999000,5,7,2184.207862,New York,"132 W 81st StNew York, NY 10024",United States,New York,New York County,40.7836212,-73.9759437
Brokered by TREBACH REALTY INC,House,2750000,4,2,2184.207862,Bronx,"4570 Delafield AveBronx, NY 10471",United States,New York,Bronx County,40.8930548,-73.9067416
Brokered by BHHS Fillmore R.E.,House,649000,3,2,1064.0,Brooklyn,"2051 E 73rd StBrooklyn, NY 11234",United States,New York,Kings County,40.6215026,-73.9066372
Brokered by Howard Hanna | Rand Realty,Multi-family home,989000,8,5,3960.0,Bronx,"3535 Ely AveBronx, NY 10466",United States,New York,Bronx County,40.8807579,-73.8418489
Brokered by Promise Realty LLC,Condo,357000,3,1,1100.0,Bronx,"5 Metropolitan Oval Apt 10FBronx, NY 10462",New York,Bronx County,The Bronx,40.8389829,-73.8601515
"Brokered by LandSeAir Real Estate Group, Inc - Bronx Little Italy Office",Co-op,119888,1,1,2184.207862,Corona,"112-50 Northern Blvd Unit 5ECorona, NY 11368",New York,Queens County,Queens,40.7582228,-73.8559216
Brokered by Joyce Realty,Multi-family home,1099999,4,2,2185.0,Bronx,"3186 Tierney PlBronx, NY 10465",United States,New York,Bronx County,40.8135939,-73.8019007
Brokered by Daniel Gale Sotheby's International Realty,House,749000,2,1,2184.207862,Fresh Meadows,"164-30 77th RdFresh Meadows, NY 11366",United States,New York,Queens County,40.7236718,-73.8030548
Brokered by Robert Defalco Realty Inc.,Multi-family home,589999,4,2,1680.0,Staten Island,"393 Heberton AveStaten Island, NY 10302",United States,New York,Richmond County,40.6314894,-74.1348461
Brokered by Homefinders of SI Inc.,House,749000,3,2,1332.0,Staten Island,"206 Watchogue RdStaten Island, NY 10314",United States,New York,Richmond County,40.6155772,-74.1364517
Brokered by Exp Realty,Condo,499000,3,2,1156.0,Ozone Park,"86-10 Dumont Ave Unit 5COzone Park, NY 11417",New York,Queens County,Queens,40.6726721,-73.8496745
Brokered by RUMIC Realty Inc,House,859000,3,3,2184.207862,Hollis,"100-03 205th PlHollis, NY 11423",United States,New York,Queens County,40.71176,-73.753743
Brokered by Corcoran Brooklyn Heights,Pending,599999,2,2,2184.207862,Brooklyn,"2601 E 24th St Apt 3BBrooklyn, NY 11235",New York,Kings County,Brooklyn,40.5887895,-73.9452357
Brokered by BROOKLYN`S 4 U REALTY,House,899000,3,2,1324.0,Brooklyn,"2277 National DrBrooklyn, NY 11234",United States,New York,Kings County,40.6055237,-73.9143161
Brokered by Bright Horizons Realty Inc,Co-op,315000,2,1,850.0,Brooklyn,"5640 Avenue T Unit 84FBrooklyn, NY 11234",New York,Kings County,Brooklyn,40.6142504,-73.9196974
"Brokered by Robert Defalco Realty, Inc.",House,1999999,5,2,5301.0,Staten Island,"220 Douglas RdStaten Island, NY 10304",United States,New York,Richmond County,40.6071393,-74.097086
Brokered by Exp Realty,House,950000,4,3,1746.0,Queens Village,"104-02 223rd StQueens Village, NY 11429",United States,New York,Queens County,40.7107548,-73.7320869
Brokered by COMPASS,Townhouse,13950000,6,6,6798.0,Manhattan,"135 E 19th StManhattan, NY 10003",United States,New York,New York County,40.736891,-73.985669
Brokered by Sovereign Realty Of Ny Inc,House,1399000,5,3,3375.0,Howard Beach,"91-09 165th AveHoward Beach, NY 11414",United States,New York,Queens County,40.6491159,-73.8389887
Brokered by COMPASS,Condo,595000,3,1,660.0,Manhattan,"55 Wall St Apt 714Manhattan, NY 10005",New York,New York County,New York,40.7059312,-74.0093393
Brokered by TALK OF THE TOWN REALTY C,House,1618000,5,2,2200.0,Brooklyn,"2247 E 66th StBrooklyn, NY 11234",United States,New York,Kings County,40.6148883,-73.9078973
Brokered by Douglas Elliman - Bayside,Pending,485000,6,3,2184.207862,Bronx,"1311 Needham AveBronx, NY 10469",United States,New York,Bronx County,40.8781862,-73.8523657
Brokered by Century 21 Awaye Realty,Contingent,748000,3,2,1592.0,Staten Island,"476 Darlington AveStaten Island, NY 10309",United States,New York,Richmond County,40.5342218,-74.2016301
Brokered by Ben Bay Realty Company of Staten Island LLC,Multi-family home,1100000,3,2,1928.0,Staten Island,"307 Ellis StStaten Island, NY 10307",United States,New York,Richmond County,40.5142085,-74.2505102
Brokered by COMPASS,Townhouse,3995000,8,8,5046.0,Manhattan,"322 W 104th StManhattan, NY 10025",United States,New York,New York County,40.80059,-73.97071
Brokered by Century 21 Realty First,Co-op,659000,1,1,440.0,Brooklyn,"202 Baltic St Unit 1Brooklyn, NY 11201",New York,Kings County,Brooklyn,40.6867525,-73.996485
Brokered by Century Homes Realty Group LLC,Multi-family home,1099000,6,3,2018.0,Corona,"58-15 Granger StCorona, NY 11368",United States,New York,Queens County,40.7385519,-73.8545527
Brokered by YourHomeSold Guarantee Realty,Condo,319000,2,2,1102.0,Bronx,"135 Sunset Blvd Unit 10135Bronx, NY 10473",United States,New York,Bronx County,40.806951,-73.853401
Brokered by Exp Realty,Multi-family home,999000,9,3,3168.0,Bronx,"1670 Nelson AveBronx, NY 10453",United States,New York,Bronx County,40.8474641,-73.9177608
Brokered by Legacy Estate Realty,Co-op,398000,3,2,1571.0,Jamaica,"170-40 Highland Ave Unit 107Jamaica, NY 11432",New York,Queens County,Queens,40.7125699,-73.79318
Brokered by New Heights Realty,Co-op,249000,3,1,500.0,New York,"100 Park Terrace Ter W Unit 1HNew York, NY 10034",New York,New York County,New York,40.8717961,-73.916064
Brokered by B Square Realty,Multi-family home,1299000,3,2,2648.0,Flushing,"149-19 46th AveFlushing, NY 11355",United States,New York,Queens County,40.7544269,-73.8114185
"Brokered by Nest Seekers International, Midtown",Townhouse,8950000,3,6,6336.0,New York,"209 E 31st StNew York, NY 10016",United States,New York,New York County,40.7437415,-73.978774
Brokered by Jaymore Realty Llc,House,750000,5,3,1500.0,South Ozone Park,"13035 146th StSouth Ozone Park, NY 11436",United States,New York,Queens County,40.6693291,-73.7924388
Brokered by COMPASS,Multi-family home,1100000,5,3,1916.0,Brooklyn,"1720 E 51st StBrooklyn, NY 11234",United States,New York,Kings County,40.6183626,-73.9260392
"Brokered by Robert Defalco Realty, Inc.",House,1275000,3,4,2380.0,Staten Island,"47 Brookside LoopStaten Island, NY 10309",United States,New York,Richmond County,40.5393625,-74.214287
Brokered by RELIABLE SELL & BUY REALTY INC,House,689000,2,2,750.0,Brooklyn,"2848 Brighton 4th StBrooklyn, NY 11235",United States,New York,Kings County,40.5817208,-73.9645608
Brokered by Exp Realty,Co-op,320000,1,1,2184.207862,Forest Hills,"2 Dartmouth St Apt M28Forest Hills, NY 11375",United States,New York,Queens County,40.7192438,-73.8499268
Brokered by Brown Harris Stevens,Townhouse,3995000,5,6,2184.207862,Brooklyn,"37 Prospect Pl Unit TownhouseBrooklyn, NY 11217",United States,New York,Kings County,40.6799381,-73.9764616
Brokered by Prestige Homes Ny Inc,Multi-family home,1399000,6,5,2500.0,Jamaica,"128-17 143rd StJamaica, NY 11436",United States,New York,Queens County,40.6717866,-73.7955639
Brokered by Cross Country Realty,House,395000,2,2,1089.0,Bronx,"111 Sunset BlvdBronx, NY 10473",United States,New York,Bronx County,40.807051,-73.853819
Brokered by COMPASS,House,1250000,4,2,2273.0,Bronx,"5037 Fieldston RdBronx, NY 10471",United States,New York,Bronx County,40.8976524,-73.9019402
Brokered by Keller Williams Realty Greater Nassau,Co-op,719000,3,2,1440.0,Forest Hills,"110-11 72nd Ave Unit 4BForest Hills, NY 11375",New York,Queens County,Queens,40.721289,-73.8403901
Brokered by EXIT REALTY PRIVATE CLIENT,Multi-family home,795000,3,4,1171.0,Bronx,"3121 Corlear AveBronx, NY 10463",United States,New York,Bronx County,40.8809803,-73.9074446
Brokered by Cypress Estates Realty LLC,Multi-family home,1175000,6,5,2184.207862,Jamaica,"115-11 142nd StJamaica, NY 11436",United States,New York,Queens County,40.6820237,-73.800217
Brokered by COMPASS,Condo,4250000,3,4,2054.0,Manhattan,"255 E 74th St Apt 16CManhattan, NY 10021",New York County,New York,Manhattan,40.7704759,-73.9574549
Brokered by Elegran Real Estate And Development,Townhouse,2500000,3,4,2201.0,New York,"240 E 29th StNew York, NY 10016",United States,New York,New York County,40.741725,-73.9786641
Brokered by 5 Boro Realty Corp,Multi-family home,850000,3,2,1600.0,Brooklyn,"3836 Laurel AveBrooklyn, NY 11224",United States,New York,Kings County,40.5776897,-74.0072206
Brokered by Elite Real Estate Group 1 Llc,House,1350000,4,2,2948.0,Bronx,"1932 Narragansett AveBronx, NY 10461",United States,New York,Bronx County,40.8548137,-73.8500157
"Brokered by Robert DeFalco Realty, Inc.",House,929000,5,2,2200.0,Staten Island,"314 Montreal AveStaten Island, NY 10306",United States,New York,Richmond County,40.5592121,-74.1263587
Brokered by EXIT HOME KEY REALTY,Townhouse,549990,3,2,2184.207862,Staten Island,"216 Hett AveStaten Island, NY 10306",United States,New York,Richmond County,40.5610279,-74.1050355
Brokered by Berkshire Hathaway,Multi-family home,1550000,6,6,2184.207862,Brooklyn,"4409 Atlantic AveBrooklyn, NY 11224",United States,New York,Kings County,40.5757051,-74.0098832
Brokered by COMPASS,Co-op,265000,1,1,2184.207862,Manhattan,"1777 Madison Ave Apt 32Manhattan, NY 10035",New York,New York County,New York,40.8003865,-73.9443376
Brokered by Milgram Brokerage,House,879000,4,2,1630.0,Fresh Meadows,"164-47 73rd AveFresh Meadows, NY 11366",United States,New York,Queens County,40.7282179,-73.8032584
"Brokered by Nest Seekers International, Westside",Land,1200000,3,2,2184.207862,New York,"2316 1st AveNew York, NY 10035",United States,New York,New York County,40.797735,-73.933806
Brokered by Douglas Elliman - 575 Madison Ave,Townhouse,7500000,4,2,4250.0,New York,"167 E 80th StNew York, NY 10075",United States,New York,New York County,40.77551,-73.957627
Brokered by Floral Homes Inc,Co-op,325000,2,1,2184.207862,New Hyde Park,"268-25 82nd Ave Unit 279BNew Hyde Park, NY 11040",New York,Queens County,Queens,40.7427699,-73.70245
Brokered by Jamie & Connie Real Estate Grp,House,755000,2,2,2184.207862,Bayside,"202-24 45th RdBayside, NY 11361",United States,New York,Queens County,40.7565607,-73.7796734
Brokered by TREBACH REALTY INC,Co-op,325000,2,2,2184.207862,Bronx,"3875 Waldo Ave Apt 2EBronx, NY 10463",New York,Bronx County,The Bronx,40.8890553,-73.9033819
Brokered by Douglas Elliman  -111 Fifth Ave,Co-op,1395000,2,1,2184.207862,New York,"258 Broadway Apt 3DNew York, NY 10007",New York,New York County,New York,40.7134524,-74.0070904
"Brokered by Robert DeFalco Realty, Inc.",House,649000,3,2,980.0,Staten Island,"1056 Arden AveStaten Island, NY 10312",United States,New York,Richmond County,40.5434215,-74.174846
Brokered by RE MAX Central,House,499999,2,1,800.0,Staten Island,"118 Cannon AveStaten Island, NY 10314",United States,New York,Richmond County,40.594453,-74.1889609
Brokered by RE MAX Elite,Multi-family home,999998,4,4,2720.0,Staten Island,"220 Nome AveStaten Island, NY 10314",United States,New York,Richmond County,40.5862681,-74.1585168
Brokered by Coldwell Banker American Homes,Multi-family home,1358000,6,3,2184.207862,Bedford Stuyvesant,"1016 Putnam AveBedford Stuyvesant, NY 11221",United States,New York,Kings County,40.6871306,-73.9215141
Brokered by TREBACH REALTY INC,House,1650000,5,4,2184.207862,Bronx,"617 W 227th StBronx, NY 10463",United States,New York,Bronx County,40.8806865,-73.9157055
