BROKERTITLE,TYPE,PRICE,BEDS,BATH,PROPERTYSQFT,STATE,MAIN_ADDRESS,ADMINISTRATIVE_AREA_LEVEL_2,LOCALITY,SUBLOCALITY,LATITUDE,LONGITUDE
Brokered by Serhant,Co-op,1695000,4,4,2184.207862,New York,"55 Liberty St Ph 31ANew York, NY 10038",New York,New York County,New York,40.7088048,-74.009407
Brokered by Serhant,Condo,1999999,3,2,1865.0,Brooklyn,"61 N Henry St Unit GardenBrooklyn, NY 11222",United States,New York,Kings County,40.7213959,-73.9430921
Brokered by Prime Realty,Condo,1150000,2,2,1850.0,Bayside,"12-29 Estates Ln Unit 223LBayside, NY 11360",New York,Queens County,Queens,40.7878758,-73.786717
Brokered by Morris Park Realty Group,Co-op,339000,2,1,822.0,Bronx,"59A Edgewater Park Unit ABronx, NY 10465",United States,New York,Bronx County,40.8224967,-73.8110903
Brokered by E Realty International Corp,House,1390000,5,2,2184.207862,Woodside,"66-05 Garfield AveWoodside, NY 11377",United States,New York,Queens County,40.7358829,-73.8988063
Brokered by Realty Executives Today,House,938000,3,2,1836.0,East Elmhurst,"19-26 81st StEast Elmhurst, NY 11370",United States,New York,Queens County,40.772306,-73.8896045
Brokered by 5 Boro Realty Corp,House,919000,6,3,5400.0,Brooklyn,"2911 Avenue DBrooklyn, NY 11226",United States,New York,Kings County,40.6410944,-73.9490931
Brokered by Ernest Chi Real Estate LLC,Co-op,425000,3,2,1150.0,Bronx,"4705 Henry Hudson Pkwy W Apt 7JBronx, NY 10471",New York,Bronx County,The Bronx,40.8952914,-73.9089308
Brokered by Realty Executives LAR Group,Multi-family home,1249000,5,2,2184.207862,Brooklyn,"2798 Pitkin AveBrooklyn, NY 11208",United States,New York,Kings County,40.6756643,-73.8687143
Brokered by Douglas Elliman - 936 Broadway,Co-op,799000,2,2,1000.0,New York,"325 E 41st St Apt 509New York, NY 10017",New York,New York County,New York,40.7490288,-73.9719957
Brokered by Corcoran Park Avenue South,Co-op,475000,1,1,750.0,Brooklyn,"100 Remsen St Apt 8KBrooklyn, NY 11201",New York,Kings County,Brooklyn,40.6939582,-73.9943695
Brokered by Keller Williams NYC,Townhouse,3800000,6,4,3340.0,Brooklyn,"464 5th StBrooklyn, NY 11215",United States,New York,Kings County,40.6694134,-73.9802538
Brokered by KORR REALTY,Co-op,325000,3,1,1200.0,Brooklyn,"3021 Avenue Z Apt 2HBrooklyn, NY 11235",New York,Kings County,Brooklyn,40.590397,-73.935927
Brokered by COMPASS,Condo,1200000,2,2,1200.0,Manhattan,"50 Pine St Apt 8SManhattan, NY 10005",New York,New York County,New York,40.7069134,-74.0085778
Brokered by Corcoran SoHo,House,6975000,2,2,3050.0,New York,"200 Mercer St Apt 5ENew York, NY 10012",New York,New York County,New York,40.7265669,-73.9967609
Brokered by Corcoran Park Avenue South,Condo,1150000,2,2,2184.207862,New York,"90 William St Apt 16GNew York, NY 10038",New York,New York County,New York,40.7081041,-74.0074731
Brokered by Corcoran Park Slope,House,2400000,4,4,3424.0,Brooklyn,"867 Sterling PlBrooklyn, NY 11216",United States,New York,Kings County,40.6727282,-73.9497962
Brokered by Douglas Elliman  -111 Fifth Ave,Co-op,3500000,4,4,2700.0,New York,"325 W 52nd St Ph GNew York, NY 10019",United States,New York,New York County,40.7641121,-73.9862772
Brokered by Realty Connect USA LLC,House,769000,3,2,2184.207862,Kew Gardens,"8496 Austin StKew Gardens, NY 11415",United States,New York,Queens County,40.7061049,-73.8263931
Brokered by Douglas Elliman - 575 Madison Ave,House,2975000,4,4,2968.0,New York,"333 E 91st St Unit 12CDNew York, NY 10128",New York,New York County,New York,40.7803429,-73.947266
Brokered by Landmark International R E Llc,Multi-family home,1860000,6,4,2184.207862,Whitestone,"149-42 17th RdWhitestone, NY 11357",United States,New York,Queens County,40.7832802,-73.8149701
Brokered by Coldwell Banker Reliable,House,4000000,32,12,7188.0,New York,"150 E 105th StNew York, NY 10029",United States,New York,New York County,40.7912881,-73.9465215
Brokered by Winzone Realty Inc,Condo,1250000,2,2,1257.0,Flushing,"131-01 40th Rd Unit 8GFlushing, NY 11354",New York,Queens County,Queens,40.7561213,-73.8368085
Brokered by Keller Williams Realty Greater Nassau,Co-op,220000,1,1,750.0,Little Neck,"245-54 62nd Ave Unit LowerLittle Neck, NY 11362",United States,New York,Queens County,40.7554479,-73.7319604
Brokered by RE MAX Elite,Multi-family home,1179987,5,4,4143.0,Staten Island,"7069 Amboy RdStaten Island, NY 10307",United States,New York,Richmond County,40.515005,-74.235135
"Brokered by Charles Rutenberg Realty, Inc.",Multi-family home,949000,7,6,3733.0,Bronx,"1040 Clay AveBronx, NY 10456",United States,New York,Bronx County,40.8282987,-73.91272
Brokered by Coldwell Banker American Homes,House,920000,5,4,2184.207862,Brooklyn,"468 E 46th StBrooklyn, NY 11203",United States,New York,Kings County,40.6502862,-73.9343518
Brokered by All Coast Real Estate LLC,Contingent,699000,3,2,1312.0,Staten Island,"74 Greencroft AveStaten Island, NY 10308",United States,New York,Richmond County,40.5513508,-74.1356934
Brokered by The Agency,Co-op,4000000,3,2,2300.0,New York,"52 Riverside Dr Apt 16ANew York, NY 10024",New York,New York County,New York,40.7840425,-73.9833243
Brokered by Katz Realty,House,649000,3,3,1456.0,Staten Island,"58 Roanoke StStaten Island, NY 10314",United States,New York,Richmond County,40.5972983,-74.1347274
Brokered by Corcoran Brooklyn Heights,Condo,1175000,1,2,1070.0,New York,"40 W 55th St Apt 4DNew York, NY 10019",New York,New York County,New York,40.7622732,-73.9767193
Brokered by RE MAX Real Estate Professionals,House,995000,2,2,800.0,Brooklyn,"1809 W 3rd StBrooklyn, NY 11223",United States,New York,Kings County,40.603454,-73.9756682
Brokered by Corcoran Williamsburg Driggs,Condo,1595000,3,2,1375.0,Brooklyn,"149 Dupont St Apt 3Brooklyn, NY 11222",New York,Kings County,Brooklyn,40.7361991,-73.9538716
Brokered by Brown Harris Stevens,Co-op,435000,3,1,2184.207862,Manhattan,"110 Thompson St Apt 2EManhattan, NY 10012",New York,New York County,New York,40.7257358,-74.0017575
Brokered by Holly's Staten Island Buzz Realty Inc.,Condo,1338000,3,2,2082.0,Staten Island,"90 Bay Street Lndg Apt 8GStaten Island, NY 10301",New York,Richmond County,Staten Island,40.6403656,-74.0737574
"Brokered by Weichert, Realtors - Larchmont",House,499000,2,2,1146.0,Bronx,"4302 Boyd AveBronx, NY 10466",United States,New York,Bronx County,40.8955154,-73.8510754
Brokered by Prospes Real Estate Corp,Multi-family home,2280000,6,5,2184.207862,Flushing,"40-18 190th StFlushing, NY 11358",United States,New York,Queens County,40.7603734,-73.7918178
Brokered by Instahomes Realty LLC,House,660000,3,2,2184.207862,Brooklyn,"949 Schenck AveBrooklyn, NY 11207",United States,New York,Kings County,40.6574259,-73.8808077
Brokered by RE MAX Edge,Co-op,349000,2,1,800.0,Brooklyn,"3235 Emmons Ave Apt 625Brooklyn, NY 11235",New York,Kings County,Brooklyn,40.5844399,-73.9316116
Brokered by Re/Max Edge,House,160000,2,1,900.0,Staten Island,"2701 Goethals Rd N Apt D4Staten Island, NY 10303",United States,New York,Richmond County,40.6281757,-74.1797234
"Brokered by Nest Seekers International, Midtown",Condo,12500000,4,4,3550.0,New York,"100 Vandam St Apt 6ANew York, NY 10013",New York,New York County,New York,40.7266327,-74.0088321
Brokered by Ilite Realty Inc,Condo,370000,3,1,462.0,Brooklyn,"1657 E 19th St Apt 8BBrooklyn, NY 11229",New York,Kings County,Brooklyn,40.6096365,-73.9544149
Brokered by COMPASS,Co-op,600000,1,1,715.0,Manhattan,"545 W 111th St Apt 2HManhattan, NY 10025",New York,New York County,New York,40.8043692,-73.964408
Brokered by Corcoran Park Avenue South,Condo,1950000,2,2,1000.0,New York,"200 E 89th St Apt 42BNew York, NY 10128",New York,New York County,New York,40.7805098,-73.9523992
Brokered by Douglas Elliman - 575 Madison Ave,Co-op,2000000,3,2,1800.0,New York,"239 E 79th St Apt 8FNew York, NY 10075",New York,New York County,New York,40.7737882,-73.9551436
Brokered by Voro Llc,Multi-family home,1250828,7,2,2184.207862,Ridgewood,"59-43 Madison StRidgewood, NY 11385",United States,New York,Queens County,40.7063804,-73.9009749
Brokered by RE MAX Real Estate Professionals,House,1149000,4,3,1800.0,Brooklyn,"284 Sullivan PlBrooklyn, NY 11225",United States,New York,Kings County,40.6644629,-73.951745
Brokered by BESMATCH REAL ESTATE,Co-op,329999,2,1,950.0,Bronx,"880 Boynton Ave Apt 18FBronx, NY 10473",New York,Bronx County,The Bronx,40.8214206,-73.8759785
Brokered by Brown Harris Stevens Forest Hills LLC,Co-op,390000,2,1,1100.0,Queens,"112-50 78th Ave Unit 2JQueens, NY 11375",United States,New York,Queens County,40.7155654,-73.8311146
Brokered by COMPASS,Co-op,400000,3,1,2184.207862,Manhattan,"2025 Broadway Apt 17GManhattan, NY 10023",New York,New York County,New York,40.7770746,-73.9824749
Brokered by Bo's Prime Realty,Co-op,239000,1,1,700.0,Brooklyn,"150 W End Ave Apt 1JBrooklyn, NY 11235",New York,Kings County,Brooklyn,40.5782536,-73.9534785
Brokered by Signature Premier Properties,Multi-family home,1188888,4,2,2184.207862,Flushing,"132-14 Horace Harding ExpyFlushing, NY 11367",United States,New York,Queens County,40.7427492,-73.8333091
Brokered by COMPASS,Condo,18500000,4,4,4856.0,Manhattan,"73 Wooster St # AManhattan, NY 10012",United States,New York,New York County,40.7238868,-74.0021541
Brokered by Mjr Real Estate Llc,Co-op,567000,3,2,2184.207862,Rego Park,"97-37 63 Rd Unit 3ERego Park, NY 11374",New York,Queens County,Queens,40.7318958,-73.8599645
Brokered by COMPASS,Condo,8900000,5,5,4297.0,Manhattan,"200 W End AveManhattan, NY 10023",United States,New York,New York County,40.7779612,-73.9854593
Brokered by RE/MAX Team,Co-op,189000,3,1,2184.207862,Jackson Heights,"90-11 35 Ave Unit 1HJackson Heights, NY 11372",New York,Queens County,Queens,40.7525699,-73.87724
Brokered by Keller Williams Rlty Landmark,House,985000,3,2,2184.207862,Jamaica,"82-61 172nd StJamaica, NY 11432",United States,New York,Queens County,40.7181351,-73.7934614
Brokered by COMPASS,Co-op,839000,3,2,1120.0,Manhattan,"447 Fort Washington Ave Apt 44Manhattan, NY 10033",New York,New York County,New York,40.8501059,-73.9387857
Brokered by Corcoran East Side,Co-op,995000,3,2,2184.207862,New York,"455 E 51st St # 4FNew York, NY 10022",New York,New York County,New York,40.7540096,-73.9637466
"Brokered by Erealty Advisors, Inc",Condo,1439000,4,2,1625.0,Brooklyn,"800 Bedford Ave Unit 4Brooklyn, NY 11205",New York,Kings County,Brooklyn,40.6972584,-73.9569997
Brokered by East Coast REALTORS Inc,Co-op,379000,2,1,900.0,Kew Gardens Hills,"144-40 71 Ave Unit 2Kew Gardens Hills, NY 11367",New York,Queens County,Queens,40.7282764,-73.8208847
Brokered by Corcoran East Side,Co-op,3195000,4,4,2184.207862,New York,"425 E 63rd StNew York, NY 10065",United States,New York,New York County,40.7617185,-73.9587133
Brokered by Werba Realty Llc,Multi-family home,1245000,5,2,1800.0,Ridgewood,"64-56 Woodbine StRidgewood, NY 11385",United States,New York,Queens County,40.7085881,-73.8934355
Brokered by COMPASS,Townhouse,1995000,4,4,2184.207862,Brooklyn,"1069 Lincoln PlBrooklyn, NY 11213",United States,New York,Kings County,40.670429,-73.9411141
Brokered by OneSpace Realty Group LLC,Multi-family home,365000,4,3,1600.0,Staten Island,"148 Brighton AveStaten Island, NY 10301",United States,New York,Richmond County,40.6352888,-74.090616
Brokered by Corcoran Long Island City,Condo,950000,2,2,1025.0,Queens,"1215 Broadway Apt 320Queens, NY 11106",United States,New York,Queens County,40.7669131,-73.9342893
Brokered by Corcoran Chelsea/Flatiron,House,4195000,6,6,2184.207862,New York,"9 Clinton StNew York, NY 10002",United States,New York,New York County,40.7210845,-73.9842397
"Brokered by John Edwards Real Estate, Inc.",Condo,209000,1,1,658.0,Bronx,"1594 Unionport Rd Apt 2ABronx, NY 10462",New York,Bronx County,The Bronx,40.8391003,-73.8566691
Brokered by Real Broker LLC,Pending,1390000,5,4,1992.0,Brooklyn,"1429 Avenue HBrooklyn, NY 11230",United States,New York,Kings County,40.6302066,-73.962272
Brokered by COMPASS,Condo,8250000,6,6,3920.0,Manhattan,"306 Mott St Unit PhtriplexManhattan, NY 10012",United States,New York,New York County,40.7250022,-73.9938611
Brokered by Remax Edge - RE/MAX EDGE,Co-op,429000,2,1,850.0,Brooklyn,"9411 Shore Rd Unit LfBrooklyn, NY 11209",United States,New York,Kings County,40.617623,-74.038637
Brokered by Douglas Elliman - 575 Madison Ave,House,950000,1,1,2184.207862,New York,"310 E 46th St Apt 17HNew York, NY 10017",New York,New York County,New York,40.751918,-73.9698335
Brokered by TALK OF THE TOWN REALTY C,House,699000,3,3,2835.0,Brooklyn,"4716 Avenue HBrooklyn, NY 11234",United States,New York,Kings County,40.6324811,-73.9306778
Brokered by Coldwell Banker Reliable,Condo,450000,1,1,724.0,Brooklyn,"2120 Ocean Ave Apt 5BBrooklyn, NY 11229",New York,Kings County,Brooklyn,40.610069,-73.9537478
Brokered by RELIABLE SELL & BUY REALTY INC,House,1190000,4,2,1500.0,Brooklyn,"2330 E 15th StBrooklyn, NY 11229",United States,New York,Kings County,40.5935138,-73.9556712
Brokered by COMPASS,Co-op,2995000,2,2,2184.207862,Manhattan,"10 Park Ave Ph 25AManhattan, NY 10016",New York,New York County,New York,40.7474421,-73.9813221
Brokered by Keller Williams Realty Greater Nassau,Condo,349980,3,1,2184.207862,Flushing,"150-38 Union Tpke Unit 8LFlushing, NY 11367",New York,Queens County,Queens,40.7187728,-73.811168
"Brokered by Homes R Us Realty of NY, Inc.",Contingent,339000,1,1,693.0,Staten Island,"4219 Amboy Rd Unit 4AStaten Island, NY 10308",New York,Richmond County,Staten Island,40.5475295,-74.1568654
Brokered by Panache Realty Co,House,649000,3,2,1257.0,Brooklyn,"287 E 34th StBrooklyn, NY 11203",United States,New York,Kings County,40.6499215,-73.9453734
Brokered by Sotheby's International Realty - East Side Manhattan Brokerage,Co-op,4695000,3,4,2600.0,New York,"1100 Park Ave # 11CNew York, NY 10128",New York,New York County,New York,40.7824395,-73.9561648
Brokered by Exp Realty,Co-op,189999,1,1,2184.207862,East Elmhurst,"32-30 93rd St Unit A7East Elmhurst, NY 11369",New York,Queens County,Queens,40.7586799,-73.8755
Brokered by Re/Max Elite,House,399888,3,4,1613.0,Bronx,"765 E 224th StBronx, NY 10466",United States,New York,Bronx County,40.8865894,-73.8585038
Brokered by CENTURY 21 Zaloom Realty,Pending,1199900,4,4,2393.0,Staten Island,"251 Wilson AveStaten Island, NY 10308",United States,New York,Richmond County,40.5477774,-74.160225
Brokered by COMPASS,Condo,1395000,3,4,2472.0,Manhattan,"52 Convent Ave Unit 1CManhattan, NY 10027",New York,New York County,New York,40.8150812,-73.9533178
Brokered by TREE OF LIFE REALTY & MANAGEMENT LLC,House,2759000,6,6,2184.207862,Brooklyn,"163 Whitman DrBrooklyn, NY 11234",United States,New York,Kings County,40.6093711,-73.9025693
Brokered by Brown Harris Stevens,Condo,2995000,4,3,2135.0,Manhattan,"303 W 113th St Unit 2Manhattan, NY 10026",New York,New York County,New York,40.802892,-73.957154
Brokered by Brown Harris Stevens W Hampton,Co-op,399000,1,1,2184.207862,Forest Hills,"102-10 66th Rd Unit 14AForest Hills, NY 11375",New York,Queens County,Queens,40.7282586,-73.8513251
Brokered by Douglas Elliman  -111 Fifth Ave,Multi-family home,16995000,5,4,4230.0,New York,"31 Grove StNew York, NY 10014",United States,New York,New York County,40.7328257,-74.0048853
Brokered by Corcoran Chelsea/Flatiron,Co-op,650000,2,1,1060.0,New York,"860 W 181st St Apt 56New York, NY 10033",New York,New York County,New York,40.8511616,-73.9408472
Brokered by TALK OF THE TOWN REALTY C,House,2599000,4,3,3510.0,Brooklyn,"2634 National DrBrooklyn, NY 11234",United States,New York,Kings County,40.6063914,-73.9020181
Brokered by COMPASS,Townhouse,1195000,4,2,2625.0,Brooklyn,"449 Classon AveBrooklyn, NY 11238",United States,New York,Kings County,40.685396,-73.959061
"Brokered by BEN BAY REALTY CO OF BAY RIDGE, LLC",House,1288000,3,2,1188.0,Brooklyn,"340 86th StBrooklyn, NY 11209",United States,New York,Kings County,40.6229377,-74.0298947
Brokered by Corcoran Williamsburg Bedford,Condo,2099000,2,2,1447.0,Brooklyn,"79 Bridge St Apt 5CBrooklyn, NY 11201",New York,Kings County,Brooklyn,40.7019045,-73.9844236
Brokered by KELLER WILLIAMS REALTY LANDMARK II,Multi-family home,1275000,5,3,1920.0,Brooklyn,"236 45th StBrooklyn, NY 11220",United States,New York,Kings County,40.6512263,-74.0131317
Brokered by New York Realty Minimax,Multi-family home,1999999,12,6,2184.207862,Brooklyn,"726 Metropolitan Ave Unit 6Brooklyn, NY 11211",New York,Kings County,Brooklyn,40.7142948,-73.9448148
Brokered by COMPASS,Townhouse,10750000,8,2,7327.0,Manhattan,"141 E 63rd StManhattan, NY 10065",United States,New York,New York County,40.764757,-73.965815
Brokered by COMPASS,Co-op,650000,1,1,2184.207862,Manhattan,"165 E 60th St Apt 5CManhattan, NY 10022",New York,New York County,New York,40.762566,-73.9667017
Brokered by Sotheby's International Realty - East Side Manhattan Brokerage,Co-op,4800000,3,4,3475.0,New York,"61 E 82nd St Apt 1ANew York, NY 10028",New York,New York County,New York,40.778129,-73.9598269
Brokered by Douglas Elliman - 2112 Frederick Douglass Blvd,Multi-family home,1279900,3,2,3812.0,New York,"51 E 126th StNew York, NY 10035",United States,New York,New York County,40.8062253,-73.9393116
Brokered by RE MAX 1st Choice,Multi-family home,1680000,7,4,3780.0,Bayside,"214-03 16 AveBayside, NY 11360",United States,New York,Queens County,40.785705,-73.778612
Brokered by Chous Realty Group Inc,Co-op,299000,1,1,850.0,Flushing,"68-09 138th St Unit 2BFlushing, NY 11367",New York,Queens County,Queens,40.7313319,-73.8284665
Brokered by Sotheby's International Realty - East Side Manhattan Brokerage,Co-op,845000,1,1,2184.207862,New York,"120 Central Park S Apt 3GNew York, NY 10019",New York,New York County,New York,40.7659315,-73.9773407
Brokered by Corcoran West Side,Co-op,415000,3,1,2184.207862,New York,"233 E 70th St Apt 6RNew York, NY 10021",New York,New York County,New York,40.7678195,-73.9594251
Brokered by Charles H. Greenthal Property,Co-op,449000,1,2,1213.0,Floral Park,"27110 Grand Central Pkwy Apt 5LFloral Park, NY 11005",New York,Queens County,Queens,40.7564761,-73.7212008
Brokered by COMPASS,Condo,1250000,3,2,1287.0,Brooklyn,"365 Bridge St Apt 8JBrooklyn, NY 11201",New York,Kings County,Brooklyn,40.6925905,-73.9849373
Brokered by Corcoran Bedford Stuyvesant,Townhouse,4395000,5,4,2184.207862,Brooklyn,"425 Pacific StBrooklyn, NY 11217",United States,New York,Kings County,40.6859683,-73.9839494
Brokered by COMPASS,Co-op,315000,1,1,2184.207862,Queens,"35-51 85th St Unit 6FQueens, NY 11372",New York,Queens County,Queens,40.7507495,-73.8811907
Brokered by COMPASS,Co-op,499000,2,1,900.0,Brooklyn,"7901 4th Ave Apt E22Brooklyn, NY 11209",New York,Kings County,Brooklyn,40.6273371,-74.0262024
"Brokered by Dawning Real Estate, Inc.",House,699000,3,2,1700.0,Staten Island,"752 Correll AveStaten Island, NY 10309",United States,New York,Richmond County,40.545028,-74.218133
Brokered by THE BOX ADVISORY LLC,Condo,625000,4,2,1268.0,Brooklyn,"762 Empire Blvd Apt 4DBrooklyn, NY 11213",New York,Kings County,Brooklyn,40.6634769,-73.936924
Brokered by City Realty Group,House,749000,3,2,2184.207862,East Elmhurst,"31-10 95th StEast Elmhurst, NY 11369",United States,New York,Queens County,40.7602045,-73.8739584
Brokered by American Homes Group,Multi-family home,949000,4,2,1600.0,Brooklyn,"154 E 22nd StBrooklyn, NY 11226",United States,New York,Kings County,40.6452346,-73.9569371
Brokered by COMPASS,Co-op,1495000,3,1,2184.207862,Brooklyn,"349 6th Ave Apt 2Brooklyn, NY 11215",New York,Kings County,Brooklyn,40.670754,-73.981349
Brokered by Brown Harris Stevens,Townhouse,2395000,6,4,3972.0,Manhattan,"438 W 162nd St Unit TownhouseManhattan, NY 10032",United States,New York,New York County,40.8351954,-73.9390016
Brokered by Momentum Real Estate Llc,House,1250000,3,4,3328.0,Staten Island,"19 Park LnStaten Island, NY 10301",United States,New York,Richmond County,40.619844,-74.0889182
Brokered by Stuyvesant Heights Realty Corp,Multi-family home,3165000,9,5,2184.207862,Stuyvesant Heights,"278 Decatur StStuyvesant Heights, NY 11233",United States,New York,Kings County,40.6813796,-73.9323311
Brokered by Brown Harris Stevens,Co-op,205000,1,1,2184.207862,Bronx,"2750 Johnson Ave Apt 5CBronx, NY 10463",New York,Bronx County,The Bronx,40.8801731,-73.91173
Brokered by Amorelli Realty LLC,Condo,1198000,1,2,2184.207862,Long Island City,"22-19 33rd St Unit 1BLong Island City, NY 11105",New York,Queens County,Queens,40.7749092,-73.9098235
Brokered by eXp Realty BKNY,House,2199000,3,3,3454.0,Brooklyn,"181 Hastings StBrooklyn, NY 11235",United States,New York,Kings County,40.5782802,-73.9442713
Brokered by COMPASS,Co-op,5495000,3,2,3000.0,Manhattan,"144 Franklin St Unit 3FManhattan, NY 10013",New York,New York County,New York,40.7193802,-74.0075316
Brokered by Elegran Real Estate And Development,Co-op,625000,1,1,2184.207862,New York,"55 E 65th St Apt 4BNew York, NY 10065",New York,New York County,New York,40.7669715,-73.9674377
Brokered by 5 Boro Realty Corp,House,1449999,3,2,1890.0,Brooklyn,"768 Herkimer StBrooklyn, NY 11233",United States,New York,Kings County,40.6783124,-73.928113
Brokered by Cross Island Realty One Inc,House,1399000,5,4,2184.207862,Floral Park,"256-16 86th AveFloral Park, NY 11001",United States,New York,Queens County,40.7326463,-73.7097434
Brokered by Douglas Elliman - 575 Madison Ave,Co-op,525000,3,1,322.0,New York,"230 Central Park W Apt 6HNew York, NY 10024",New York,New York County,New York,40.7836703,-73.9709274
Brokered by COMPASS,Townhouse,12000000,4,2,5500.0,Manhattan,"22 E 78th StManhattan, NY 10075",United States,New York,New York County,40.7756853,-73.9632303
Brokered by RE MAX Real Estate Professionals,House,1299000,3,2,1700.0,Brooklyn,"74 89th StBrooklyn, NY 11209",United States,New York,Kings County,40.622512,-74.038316
Brokered by Private Homes Realty LLC,Co-op,269000,1,1,2184.207862,Jackson Heights,"37-21 80 St Unit 6TJackson Heights, NY 11372",New York,Queens County,Queens,40.7490728,-73.8859424
Brokered by COMPASS,Co-op,450000,1,1,2184.207862,Manhattan,"152 E 83rd St Apt 3DManhattan, NY 10028",New York,New York County,New York,40.777093,-73.956552
Brokered by Spiegel Realty LLC,Multi-family home,899999,4,2,2194.0,Staten Island,"243 Deems AveStaten Island, NY 10314",United States,New York,Richmond County,40.6172199,-74.1320669
Brokered by 5 Boro Realty Corp,House,925000,2,2,1077.0,Brooklyn,"1336 Dean StBrooklyn, NY 11216",United States,New York,Kings County,40.6764806,-73.9446731
Brokered by Dreamlife Realty New York Llc,Co-op,279000,1,1,600.0,Brooklyn,"680 81st St Apt 3DBrooklyn, NY 11228",New York,Kings County,Brooklyn,40.6220567,-74.0200513
Brokered by Corcoran East Side,Condo,1795000,2,2,2184.207862,New York,"230 Riverside Dr Apt 8ANew York, NY 10025",New York,New York County,New York,40.7954592,-73.9753123
Brokered by Brown Harris Stevens - 130 Fifth Avenue,Pending,1250000,2,2,2184.207862,Manhattan,"60 Gramercy Park N Apt 2HManhattan, NY 10010",New York,New York County,New York,40.7385938,-73.9863188
Brokered by RE MAX Edge,Condo,560000,3,1,622.0,Brooklyn,"4711 8th Ave Apt 2BBrooklyn, NY 11220",New York,Kings County,Brooklyn,40.6423834,-74.002033
"Brokered by Compass Greater Ny, Llc",House,999000,3,2,1260.0,Belle Harbor,"423 Beach 126th StBelle Harbor, NY 11694",United States,New York,Queens County,40.5792491,-73.8470867
Brokered by Mitra Hakimi Realty Group LLC,Multi-family home,1188000,6,2,2186.0,Saint Albans,"188-39 Ilion AveSaint Albans, NY 11412",United States,New York,Queens County,40.7021006,-73.7671144
Brokered by Lombardo Homes & Estates,House,948888,3,1,950.0,Brooklyn,"1611 Oriental BlvdBrooklyn, NY 11235",United States,New York,Kings County,40.5786958,-73.938485
"Brokered by Rising Star Realty and Property Management, Inc.",Condo,735000,2,2,832.0,Brooklyn,"1370 Bushwick Ave Apt 2ABrooklyn, NY 11207",New York,Kings County,Brooklyn,40.6850765,-73.9107349
Brokered by Keller Williams NYC - New York Living Solutions,Multi-family home,1399000,13,5,2184.207862,Brooklyn,"487 E 93rd St Unit 1Brooklyn, NY 11212",New York,Kings County,Brooklyn,40.6550656,-73.9183469
Brokered by COMPASS,Co-op,3600000,3,4,2184.207862,Manhattan,"900 5th Ave Apt 4BManhattan, NY 10021",New York,New York County,New York,40.7719126,-73.967281
Brokered by COMPASS,Multi-family home,1850000,8,4,5000.0,Manhattan,"216 E 117th StManhattan, NY 10035",United States,New York,New York County,40.7981001,-73.9389098
"Brokered by Realmart Realty, LLC",Co-op,789000,2,1,2184.207862,New York,"340 W 19th St Apt 4New York, NY 10011",New York,New York County,New York,40.7432035,-74.0015019
Brokered by Ps 91 Real Estate,House,569000,3,1,2184.207862,Queens Village,"110-25 217 St Unit 11146-0021Queens Village, NY 11429",United States,New York,Queens County,40.7079268,-73.7400399
Brokered by COMPASS,Condo,1700000,2,2,1135.0,Manhattan,"2 Cornelia St Apt 203Manhattan, NY 10014",New York,New York County,New York,40.7315509,-74.0013914
Brokered by Corcoran Park Avenue South,Condo,12995000,4,4,4155.0,New York,"10 Greene StNew York, NY 10013",United States,New York,New York County,40.7207039,-74.0027289
Brokered by Real Broker Llc,Co-op,295000,2,1,613.0,New York,"552 W 141st St Apt 2DNew York, NY 10031",New York,New York County,New York,40.8233518,-73.9515728
Brokered by IZSA - Miriam Izsak Realty LLC,Co-op,625000,1,1,650.0,New York,"245 E 25th St Apt 8LNew York, NY 10010",New York,New York County,New York,40.7395218,-73.9802307
"Brokered by Nest Seekers International, Tribeca",Condo,399000,3,1,391.0,Queens,"30-38 29th St Unit 2BQueens, NY 11102",United States,New York,Queens County,40.7668236,-73.9239725
Brokered by Douglas Elliman - 140 Franklin,Condo,5700000,3,4,2357.0,New York,"565 Broome St Apt N9ENew York, NY 10013",New York,New York County,New York,40.7242197,-74.0056368
Brokered by PULLINI REALTY CORP.,Condo,618000,3,2,2184.207862,Brooklyn,"2805 E 28th St Apt 1BBrooklyn, NY 11235",New York,Kings County,Brooklyn,40.5846429,-73.9407155
Brokered by Morris Park Realty Group,Co-op,149999,1,1,694.0,Bronx,"5621 Netherland Ave Apt 3CBronx, NY 10471",New York,Bronx County,The Bronx,40.9049984,-73.9065719
